,Author,Title,Journal,Year of publication,DOI number,Scholar Links
0, G.Q. Xiao et al., High intensity heavy ion accelerator facility (HIAF) in China, Nucl Instrum Meth A,2013,https://doi.org/10.1016%2Fj.nimb.2013.08.046,http://scholar.google.com/scholar_lookup?&title=High%20intensity%20heavy%20ion%20accelerator%20facility%20%28HIAF%29%20in%20China&journal=Nucl.%20Instrum.%20Meth.%20A.&doi=10.1016%2Fj.nimb.2013.08.046&volume=317&pages=263-265&publication_year=2013&author=Yang%2CJC&author=Xia%2CJW&author=Xiao%2CGQ
1,No Data Found, Construction of the high intensity heavy-ion accelerator facility (HIAF), AAPPS Bull,2019,No DOI,http://scholar.google.com/scholar_lookup?&title=Construction%20of%20the%20high%20intensity%20heavy-ion%20accelerator%20facility%20%28HIAF%29&journal=AAPPS%20Bull.&volume=29&issue=2&pages=6-12&publication_year=2019&author=Zhou%2CXH
2, Y. Yang et al., Status of intense permanent magnet proton source for China-accelerator driven subcritical system Linac, Rev Sci Instrum,2016,https://doi.org/10.1063%2F1.4932314,http://scholar.google.com/scholar_lookup?&title=Status%20of%20intense%20permanent%20magnet%20proton%20source%20for%20China-accelerator%20driven%20subcritical%20system%20Linac&journal=Rev.%20Sci.%20Instrum.&doi=10.1063%2F1.4932314&volume=87&publication_year=2016&author=Wu%2CQ&author=Ma%2CHY&author=Yang%2CY
3, W. Lu et al., Advancement of highly-charged ion beam production by superconducting ECR ion source SECRAL, Rev Sci Instrum,2016,https://doi.org/10.1063%2F1.4933123,http://scholar.google.com/scholar_lookup?&title=Advancement%20of%20highly-charged%20ion%20beam%20production%20by%20superconducting%20ECR%20ion%20source%20SECRAL&journal=Rev.%20Sci.%20Instrum.&doi=10.1063%2F1.4933123&volume=87&publication_year=2016&author=Sun%2CL&author=Guo%2CJW&author=Lu%2CW
4, Yokohama, 2015),,No Data Found,No DOI,http://scholar.google.com/scholar_lookup?&title=Challenges%20for%20the%20next-generation%20ECRIS.%20Proceedings%20of%20HIAT%C2%A02015&pages=268-270&publication_year=2015&author=Sun%2CL&author=Zhao%2CHW&author=Guo%2CJW
5, H.W. Zhao et al., Progress on the development of key technologies for the fourth generation ECR ion source FECR, J Phys Conf Ser,2022,https://doi.org/10.1088%2F1742-6596%2F2244%2F1%2F012021,http://scholar.google.com/scholar_lookup?&title=Progress%20on%20the%20development%20of%20key%20technologies%20for%20the%20fourth%20generation%20ECR%20ion%20source%20FECR&journal=J.%20Phys.%20Conf.%20Ser.&doi=10.1088%2F1742-6596%2F2244%2F1%2F012021&volume=2244&publication_year=2022&author=Sun%2CL&author=Lu%2CW&author=Zhao%2CHW
6, Z. Wang et al., Beam dynamics design of HIAF RFQ, Inter J Mod Phys,2021,https://doi.org/10.1142%2FS0218301321501044,http://scholar.google.com/scholar_lookup?&title=Beam%20dynamics%20design%20of%20HIAF%20RFQ&journal=Inter.%20J.%20Mod.%20Phys.%20E&doi=10.1142%2FS0218301321501044&volume=30&issue=12&publication_year=2021&author=Wang%2CC&author=Dou%2CW&author=Wang%2CZ
7, G.H. Rees, Multiturn injection and lattice design for HIDIF, Nucl Instrum Meth A,1998,https://doi.org/10.1016%2FS0168-9002%2898%2900406-9,http://scholar.google.com/scholar_lookup?&title=Multiturn%20injection%20and%20lattice%20design%20for%20HIDIF&journal=Nucl.%20Instrum.%20Meth.%20A.&doi=10.1016%2FS0168-9002%2898%2900406-9&volume=415&pages=357-362&publication_year=1998&author=Prior%2CCR&author=Rees%2CGH
8, J.A. Wheeler, The mechanism of nuclear fission, Phys Rev,1939,https://doi.org/10.1103%2FPhysRev.56.426,http://scholar.google.com/scholar_lookup?&title=The%20mechanism%20of%20nuclear%20fission&journal=Phys.%20Rev.&doi=10.1103%2FPhysRev.56.426&volume=56&pages=426-450&publication_year=1939&author=Bohr%2CN&author=Wheeler%2CJA
9, A.S. Jensen et al., Funny Hills: the shell-correction approach to nuclear shell effects and its applications to the fission process, Rev Mod Phys,1972,https://doi.org/10.1103%2FRevModPhys.44.320,http://scholar.google.com/scholar_lookup?&title=Funny%20Hills%3A%20the%20shell-correction%20approach%20to%20nuclear%20shell%20effects%20and%20its%20applications%20to%20the%20fission%20process&journal=Rev.%20Mod.%20Phys.&doi=10.1103%2FRevModPhys.44.320&volume=44&pages=320-405&publication_year=1972&author=Brack%2CM&author=Damgaard%2CJ&author=Jensen%2CAS
10,No Data Found, Shell effects in nuclear masses and deformation energies, Nucl Phys,1967,https://doi.org/10.1016%2F0375-9474%2867%2990510-6,http://scholar.google.com/scholar_lookup?&title=Shell%20effects%20in%20nuclear%20masses%20and%20deformation%20energies&journal=Nucl.%20Phys.%20A&doi=10.1016%2F0375-9474%2867%2990510-6&volume=95&pages=420-442&publication_year=1967&author=Strutinsky%2CVM
11, A. Sobiczewski et al., On the nuclear structure and stability of heavy and super-heavy elements, Nucl Phys,1969,https://doi.org/10.1016%2F0375-9474%2869%2990809-4,http://scholar.google.com/scholar_lookup?&title=On%20the%20nuclear%20structure%20and%20stability%20of%20heavy%20and%20super-heavy%20elements&journal=Nucl.%20Phys.%20A&doi=10.1016%2F0375-9474%2869%2990809-4&volume=131&pages=1-66&publication_year=1969&author=Nilsson%2CSG&author=Tsang%2CCF&author=Sobiczewski%2CA
12, G.M. Ter-Akopian, Super-heavy nuclei: from predictions to discovery, Phys Scr,2017,https://doi.org/10.1088%2F1402-4896%2Faa53c1,http://scholar.google.com/scholar_lookup?&title=Super-heavy%20nuclei%3A%20from%20predictions%20to%20discovery&journal=Phys.%20Scr.&doi=10.1088%2F1402-4896%2Faa53c1&volume=92&publication_year=2017&author=Oganessian%2CYuT&author=Sobiczewski%2CA&author=Ter-Akopian%2CGM
13, V.K. Utyonkov, Super-heavy element research, Rep Prog Phys,2015,https://doi.org/10.1088%2F0034-4885%2F78%2F3%2F036301,http://scholar.google.com/scholar_lookup?&title=Super-heavy%20element%20research&journal=Rep.%20Prog.%20Phys.&doi=10.1088%2F0034-4885%2F78%2F3%2F036301&volume=78&publication_year=2015&author=Oganessian%2CYuT&author=Utyonkov%2CVK
14, G. Munzenberg, The discovery of the heaviest elements, Rev Mod Phys,2000,https://doi.org/10.1103%2FRevModPhys.72.733,http://scholar.google.com/scholar_lookup?&title=The%20discovery%20of%20the%20heaviest%20elements&journal=Rev.%20Mod.%20Phys.&doi=10.1103%2FRevModPhys.72.733&volume=72&issue=3&pages=733-767&publication_year=2000&author=Hofmann%2CS&author=Munzenberg%2CG
15,No Data Found, SHE research at RIKEN/GARIS, Nucl Phys,2015,https://doi.org/10.1016%2Fj.nuclphysa.2015.10.007,http://scholar.google.com/scholar_lookup?&title=SHE%20research%20at%20RIKEN%2FGARIS&journal=Nucl.%20Phys.%20A&doi=10.1016%2Fj.nuclphysa.2015.10.007&volume=944&pages=30-61&publication_year=2015&author=Morita%2CK
16, W. Greiner, Cross sections for the production of super-heavy nuclei, Nucl Phys,2015,https://doi.org/10.1016%2Fj.nuclphysa.2015.02.010,http://scholar.google.com/scholar_lookup?&title=Cross%20sections%20for%20the%20production%20of%20super-heavy%20nuclei&journal=Nucl.%20Phys.%20A&doi=10.1016%2Fj.nuclphysa.2015.02.010&volume=944&pages=257-307&publication_year=2015&author=Zagrebaev%2CVI&author=Greiner%2CW
17, A. Yakushev, Chemical studies of elements with Z≥104 in gas phase, Nucl Phys,2015,https://doi.org/10.1016%2Fj.nuclphysa.2015.09.012,http://scholar.google.com/scholar_lookup?&title=Chemical%20studies%20of%20elements%20with%20Z%E2%89%A5104%20in%20gas%20phase&journal=Nucl.%20Phys.%20A&doi=10.1016%2Fj.nuclphysa.2015.09.012&volume=944&pages=640-689&publication_year=2015&author=Turler%2CA&author=Eichler%2CR&author=Yakushev%2CA
18, Sassy, a gas-filled magnetic separator for the study of fusion reaction products, Nucl Instrum Meth A,1988,https://doi.org/10.1016%2F0168-9002%2888%2990877-7,http://scholar.google.com/scholar_lookup?&title=Sassy%2C%20a%20gas-filled%20magnetic%20separator%20for%20the%20study%20of%20fusion%20reaction%20products&journal=Nucl.%20Instrum.%20Meth.%20A.&doi=10.1016%2F0168-9002%2888%2990877-7&volume=269&issue=1&pages=192-201&publication_year=1988&author=Ghiorso%2CA&author=Yashita%2CS&author=Leino%2CME
19,No Data Found, Gas-filled separators-an overview, Nucl Instrum Meth A,2003,https://doi.org/10.1016%2FS0168-583X%2802%2901901-8,http://scholar.google.com/scholar_lookup?&title=Gas-filled%20separators-an%20overview&journal=Nucl.%20Instrum.%20Meth.%20A.&doi=10.1016%2FS0168-583X%2802%2901901-8&volume=204&pages=129-137&publication_year=2003&author=Leino%2CM
20, Z.G. Gan et al., A gas-filled recoil separator, SHANS Nucl Instrum Meth B,2013,https://doi.org/10.1016%2Fj.nimb.2013.05.062,http://scholar.google.com/scholar_lookup?&title=A%20gas-filled%20recoil%20separator&journal=SHANS.%20Nucl.%20Instrum.%20Meth.%20B.&doi=10.1016%2Fj.nimb.2013.05.062&volume=317&pages=315-318&publication_year=2013&author=Zhang%2CZY&author=Ma%2CL&author=Gan%2CZG
21, H. Jia et al., Ion-optical design and multiparticle tracking in 3D magnetic field of the gas-filled recoil separator SHANS2 at CAFE2, Nucl Instrum Meth A,2021,https://doi.org/10.1016%2Fj.nima.2021.165348,http://scholar.google.com/scholar_lookup?&title=Ion-optical%20design%20and%20multiparticle%20tracking%20in%203D%20magnetic%20field%20of%20the%20gas-filled%20recoil%20separator%20SHANS2%20at%20CAFE2&journal=Nucl.%20Instrum.%20Meth.%20A.&doi=10.1016%2Fj.nima.2021.165348&volume=1004&publication_year=2021&author=Sheng%2CLN&author=Hu%2CQ&author=Jia%2CH
22, W. Greiner, Production of heavy trans-target nuclei in multinucleon transfer reactions, Phys Rev,2013,https://doi.org/10.1103%2FPhysRevC.87.034608,http://scholar.google.com/scholar_lookup?&title=Production%20of%20heavy%20trans-target%20nuclei%20in%20multinucleon%20transfer%20reactions&journal=Phys.%20Rev.%20C&doi=10.1103%2FPhysRevC.87.034608&volume=87&publication_year=2013&author=Zagrebaev%2CVI&author=Greiner%2CW
23, K.J. Moody, Syntheses of transuranium isotopes with atomic numbers Z ≤ 103 in multi-nucleon transfer reactions, Nucl Phys,2015,https://doi.org/10.1016%2Fj.nuclphysa.2015.06.004,http://scholar.google.com/scholar_lookup?&title=Syntheses%20of%20transuranium%20isotopes%20with%20atomic%20numbers%20Z%20%E2%89%A4%20103%20in%20multi-nucleon%20transfer%20reactions&journal=Nucl.%20Phys.%20A&doi=10.1016%2Fj.nuclphysa.2015.06.004&volume=944&pages=117-157&publication_year=2015&author=Kratz%2CJV&author=Loveland%2CW&author=Moody%2CKJ
24, Research program of super-heavy elements and nuclides based on HIAF. SCIENTIA SINICA Physica, Mechanica & Astronomica 50(11),,2020,https://doi.org/10.1360%2FSSPMA-2020-0288,http://scholar.google.com/scholar_lookup?&title=Research%20program%20of%20super-heavy%20elements%20and%20nuclides%20based%20on%20HIAF&journal=SCIENTIA%20SINICA%20Physica%2C%20Mechanica%20%26%20Astronomica&doi=10.1360%2FSSPMA-2020-0288&volume=50&issue=11&publication_year=2020&author=Xiaohong%2CZ&author=Zhiyuan%2CZ&author=Zaiguo%2CG
25, J. Pniewski, Delayed disintegration of a heavy nuclear fragment, Phil Mag,1953,https://doi.org/10.1080%2F14786440308520318,http://scholar.google.com/scholar_lookup?&title=Delayed%20disintegration%20of%20a%20heavy%20nuclear%20fragment&journal=Phil.%20Mag.&doi=10.1080%2F14786440308520318&volume=44&pages=348-350&publication_year=1953&author=Danysz%2CM&author=Pniewski%2CJ
26,No Data Found, 50 years of hypernuclear physics: I, The early experiments Nucl Phys,2005,https://doi.org/10.1016%2Fj.nuclphysa.2005.01.002,http://scholar.google.com/scholar_lookup?&title=50%20years%20of%20hypernuclear%20physics%3A%20I&journal=The%20early%20experiments.%20Nucl.%20Phys.%20A&doi=10.1016%2Fj.nuclphysa.2005.01.002&volume=754&pages=3-13&publication_year=2005&author=Davis%2CDH
27, H. Tamura, Spectroscopy of Λ hypernuclides, Prog Part Nucl Phys,2006,https://doi.org/10.1016%2Fj.ppnp.2005.07.001,http://scholar.google.com/scholar_lookup?&title=Spectroscopy%20of%20%CE%9B%20hypernuclides&journal=Prog.%20Part.%20Nucl.%20Phys.&doi=10.1016%2Fj.ppnp.2005.07.001&volume=57&pages=564-653&publication_year=2006&author=Hashimoto%2CO&author=Tamura%2CH
28, V. Drozd et al., New directions in hypernuclear physics, Nat Rev Phys,2021,https://doi.org/10.1038%2Fs42254-021-00371-w,http://scholar.google.com/scholar_lookup?&title=New%20directions%20in%20hypernuclear%20physics&journal=Nat.%20Rev.%20Phys.&doi=10.1038%2Fs42254-021-00371-w&volume=31&pages=803-813&publication_year=2021&author=Saito%2CTR&author=Dou%2CW&author=Drozd%2CV
29, S.D. Katz et al., The QCD transition temperature: results with physical masses in the continuum limit, Phys Lett,2006,https://doi.org/10.1016%2Fj.physletb.2006.10.021,http://scholar.google.com/scholar_lookup?&title=The%20QCD%20transition%20temperature%3A%20results%20with%20physical%20masses%20in%20the%20continuum%20limit&journal=Phys.%20Lett.%20B&doi=10.1016%2Fj.physletb.2006.10.021&volume=643&pages=46-54&publication_year=2006&author=Aoki%2CY&author=Fodor%2CZ&author=Katz%2CSD
30, Y.F. Deng et al., Nature of the deconfining phase transition in SU(3) lattice gauge theory, Phys Rev Lett,1988,https://doi.org/10.1103%2FPhysRevLett.61.2058,http://scholar.google.com/scholar_lookup?&title=Nature%20of%20the%20deconfining%20phase%20transition%20in%20SU%283%29%20lattice%20gauge%20theory&journal=Phys.%20Rev.%20Lett.&doi=10.1103%2FPhysRevLett.61.2058&volume=61&pages=2058-2061&publication_year=1988&author=Brown%2CR&author=Christ%2CNH&author=Deng%2CYF
31, B. Mohanty et al., Scale for the phase diagram of quantum chromodynamics,,2011,https://doi.org/10.1126%2Fscience.1204621,http://scholar.google.com/scholar_lookup?&title=Scale%20for%20the%20phase%20diagram%20of%20quantum%20chromodynamics&journal=Science&doi=10.1126%2Fscience.1204621&volume=332&pages=1525-1528&publication_year=2011&author=Gupta%2CS&author=Luo%2CXF&author=Mohanty%2CB
32,No Data Found,NuPECC Long Range Plan 2017: perspectives for nuclear physics,,No Data Found,No DOI,No Google Scholar Link
33,No Data Found,Reaching for the horizon: the long rang plan for nuclear science,,No Data Found,No DOI,No Google Scholar Link
34, B. Mohanty, The Little-Bang and the femto-nova in nucleus-nucleus collisions, AAPPS Bull,2021,https://doi.org/10.1007%2Fs43673-021-00002-7,http://scholar.google.com/scholar_lookup?&title=The%20Little-Bang%20and%20the%20femto-nova%20in%20nucleus-nucleus%20collisions&journal=AAPPS%20Bull.&doi=10.1007%2Fs43673-021-00002-7&volume=31&pages=1-16&publication_year=2021&author=Nu%2CXu&author=Fukushima%2CK&author=Mohanty%2CB
35, O. Hashimoto et al., Measurements of interaction cross sections and nuclear radii in the light p-shell region, Phys Rev Lett,1985,https://doi.org/10.1103%2FPhysRevLett.55.2676,http://scholar.google.com/scholar_lookup?&title=Measurements%20of%20interaction%20cross%20sections%20and%20nuclear%20radii%20in%20the%20light%20p-shell%20region&journal=Phys.%20Rev.%20Lett.&doi=10.1103%2FPhysRevLett.55.2676&volume=55&pages=2676-2679&publication_year=1985&author=Tanihata%2CI&author=Hamagaki%2CH&author=Hashimoto%2CO
36, B. Jonson, The neutron halo of extremely neutron-rich nuclei, Europhys Lett,1987,https://doi.org/10.1209%2F0295-5075%2F4%2F4%2F005,http://scholar.google.com/scholar_lookup?&title=The%20neutron%20halo%20of%20extremely%20neutron-rich%20nuclei&journal=Europhys.%20Lett.&doi=10.1209%2F0295-5075%2F4%2F4%2F005&volume=4&issue=4&pages=409-414&publication_year=1987&author=Hansen%2CPG&author=Jonson%2CB
37, M. Winkler et al., The Super-FRS project at GSI, Nucl Instrum Meth B,2003,https://doi.org/10.1016%2FS0168-583X%2802%2901893-1,http://scholar.google.com/scholar_lookup?&title=The%20Super-FRS%20project%20at%20GSI&journal=Nucl.%20Instrum.%20Meth.%20B.&doi=10.1016%2FS0168-583X%2802%2901893-1&volume=204&pages=71-85&publication_year=2003&author=Geissel%2CH&author=Weick%2CH&author=Winkler%2CM
38,No Data Found,Scientific Program of the Super-FRS Collaboration: report of the collaboration to the FAIR management,,No Data Found,No DOI,No Google Scholar Link
39, Z. Harman et al., Isotope shift in the dielectronic recombination of three-electron ANd57+, Phys Rev Lett,2008,https://doi.org/10.1103%2FPhysRevLett.100.073201,http://scholar.google.com/scholar_lookup?&title=Isotope%20shift%20in%20the%20dielectronic%20recombination%20of%20three-electron%20ANd57%2B&journal=Phys.%20Rev.%20Lett.&doi=10.1103%2FPhysRevLett.100.073201&volume=100&publication_year=2008&author=Brandau%2CC&author=Kozhuharov%2CC&author=Harman%2CZ
40, D.A. Orlov et al., Screened radiative corrections from hyperfine-split dielectronic resonances in lithiumlike scandium, Phys Rev Lett,2008,https://doi.org/10.1103%2FPhysRevLett.100.033001,http://scholar.google.com/scholar_lookup?&title=Screened%20radiative%20corrections%20from%20hyperfine-split%20dielectronic%20resonances%20in%20lithiumlike%20scandium&journal=Phys.%20Rev.%20Lett.&doi=10.1103%2FPhysRevLett.100.033001&volume=100&publication_year=2008&author=Lestinsky%2CM&author=Lindroth%2CE&author=Orlov%2CDA
41, D. Bernhardt et al., Storage-ring measurement of the hyperfine induced 47Ti8+ (2s2p 3P0 → 2s2 1S0) transition rate, Phys Rev Lett,2007,https://doi.org/10.1103%2FPhysRevLett.98.033001,http://scholar.google.com/scholar_lookup?&title=Storage-ring%20measurement%20of%20the%20hyperfine%20induced%2047Ti8%2B%20%282s2p%203P0%20%E2%86%92%202s2%201S0%29%20transition%20rate&journal=Phys.%20Rev.%20Lett.&doi=10.1103%2FPhysRevLett.98.033001&volume=98&publication_year=2007&author=Schippers%2CS&author=Schmidt%2CEW&author=Bernhardt%2CD
42, Berlin, 2012),,No Data Found,No DOI,http://scholar.google.com/scholar_lookup?&title=Storage-ring%20studies%20of%20dielectronic%20recombination%20as%20a%20tool%20for%20precision%20spectroscopy&doi=10.1007%2F978-3-642-25569-4_11&pages=283-306&publication_year=2012&author=Brandau%2CC&author=Kozhuharov%2CC
43, B. Aurand et al., Physics book: CRYRING@ESR, Eur Phys J,2016,https://doi.org/10.1140%2Fepjst%2Fe2016-02643-6,http://scholar.google.com/scholar_lookup?&title=Physics%20book%3A%20CRYRING%40ESR&journal=Eur.%20Phys.%20J.%20Special%20Topics&doi=10.1140%2Fepjst%2Fe2016-02643-6&volume=225&pages=797-882&publication_year=2016&author=Lestinsky%2CM&author=Andrianov%2CV&author=Aurand%2CB
44, X. Xu et al., Dielectronic and trielectronic recombination rate coefficients of Be-like Ar14+, Astrophys J Suppl Ser,2018,https://doi.org/10.3847%2F1538-4365%2Faaa5b3,http://scholar.google.com/scholar_lookup?&title=Dielectronic%20and%20trielectronic%20recombination%20rate%20coefficients%20of%20Be-like%20Ar14%2B&journal=Astrophys.%20J.%20Suppl.%20Ser.&doi=10.3847%2F1538-4365%2Faaa5b3&volume=235&publication_year=2018&author=Huang%2CZK&author=Wen%2CWQ&author=Xu%2CX
45, S.X. Wang et al., Absolute rate coefficients for dielectronic recombination of Na-like Kr25+, Phys Rev,2020,https://doi.org/10.1103%2FPhysRevA.102.062823,http://scholar.google.com/scholar_lookup?&title=Absolute%20rate%20coefficients%20for%20dielectronic%20recombination%20of%20Na-like%20Kr25%2B&journal=Phys.%20Rev.%20A&doi=10.1103%2FPhysRevA.102.062823&volume=102&publication_year=2020&author=Huang%2CZK&author=Wen%2CWQ&author=Wang%2CSX
46, X. Xu et al., Dielectronic recombination experiments at the storage rings: from the present CSR to the future HIAF, Nucl Instrum Meth B,2017,https://doi.org/10.1016%2Fj.nimb.2017.04.024,http://scholar.google.com/scholar_lookup?&title=Dielectronic%20recombination%20experiments%20at%20the%20storage%20rings%3A%20from%20the%20present%20CSR%20to%20the%20future%20HIAF&journal=Nucl.%20Instrum.%20Meth.%20B.&doi=10.1016%2Fj.nimb.2017.04.024&volume=408&pages=135-139&publication_year=2017&author=Huang%2CZK&author=Wen%2CWQ&author=Xu%2CX
47, S.F. Zhang et al., HIAF: new opportunities for atomic physics with highly-charged heavy ions, Nucl Instrum Meth B,2017,https://doi.org/10.1016%2Fj.nimb.2017.03.129,http://scholar.google.com/scholar_lookup?&title=HIAF%3A%20new%20opportunities%20for%20atomic%20physics%20with%20highly-charged%20heavy%20ions&journal=Nucl.%20Instrum.%20Meth.%20B.&doi=10.1016%2Fj.nimb.2017.03.129&volume=408&pages=169-173&publication_year=2017&author=Ma%2CX&author=Wen%2CWQ&author=Zhang%2CSF
48, W. Greiner, Electron shells in over-critical external fields, Z Phy,1972,https://doi.org/10.1007%2FBF01398198,http://scholar.google.com/scholar_lookup?&title=Electron%20shells%20in%20over-critical%20external%20fields&journal=Z.%20Phy.%20A&doi=10.1007%2FBF01398198&volume=257&pages=62-77&publication_year=1972&author=Muller%2CB&author=Rafelski%2CJ&author=Greiner%2CW
49, J. Reinhardt et al., Positron production in crossed beams of bare uranium nuclei, Phys Rev,1988,https://doi.org/10.1103%2FPhysRevA.37.1449,http://scholar.google.com/scholar_lookup?&title=Positron%20production%20in%20crossed%20beams%20of%20bare%20uranium%20nuclei&journal=Phys.%20Rev.%20A&doi=10.1103%2FPhysRevA.37.1449&volume=37&pages=1449-1455&publication_year=1988&author=Muller%2CU&author=Reus%2CT&author=Reinhardt%2CJ
50, I.I. Tupitsyn et al., Electron-positron pair creation in low-energy collisions of heavy bare nuclei, Phys Rev,2015,https://doi.org/10.1103%2FPhysRevA.91.032708,http://scholar.google.com/scholar_lookup?&title=Electron-positron%20pair%20creation%20in%20low-energy%20collisions%20of%20heavy%20bare%20nuclei&journal=Phys.%20Rev.%20A&doi=10.1103%2FPhysRevA.91.032708&volume=91&publication_year=2015&author=Maltsev%2CIA&author=Shabaev%2CVM&author=Tupitsyn%2CII
51, A. Brauning-Demian et al., Atomic physics with highly-charged heavy ions at the GSI future facility: the scientific program of the SPARC collaboration, Nucl Instrum Meth B,2005,https://doi.org/10.1016%2Fj.nimb.2005.03.082,http://scholar.google.com/scholar_lookup?&title=Atomic%20physics%20with%20highly-charged%20heavy%20ions%20at%20the%20GSI%20future%20facility%3A%20the%20scientific%20program%20of%20the%20SPARC%20collaboration&journal=Nucl.%20Instrum.%20Meth.%20B.&doi=10.1016%2Fj.nimb.2005.03.082&volume=233&pages=28-30&publication_year=2005&author=Gumberidze%2CA&author=Bosch%2CF&author=Brauning-Demian%2CA
52, C. Thibault, Recent trends in the determination of nuclear masses, Rev Mod Phys,2003,https://doi.org/10.1103%2FRevModPhys.75.1021,http://scholar.google.com/scholar_lookup?&title=Recent%20trends%20in%20the%20determination%20of%20nuclear%20masses&journal=Rev.%20Mod.%20Phys.&doi=10.1103%2FRevModPhys.75.1021&volume=75&pages=1021-1082&publication_year=2003&author=Lunney%2CD&author=Pearson%2CJM&author=Thibault%2CC
53,No Data Found, High-accuracy mass spectrometry with stored ions, Phys Rep,2006,https://doi.org/10.1016%2Fj.physrep.2005.10.011,http://scholar.google.com/scholar_lookup?&title=High-accuracy%20mass%20spectrometry%20with%20stored%20ions&journal=Phys.%20Rep.&doi=10.1016%2Fj.physrep.2005.10.011&volume=425&pages=1-78&publication_year=2006&author=Blaum%2CK
54, J. Aysto, Ion traps in nuclear physics-recent results and achievements, Prog Part Nucl Phys,2016,https://doi.org/10.1016%2Fj.ppnp.2016.08.001,http://scholar.google.com/scholar_lookup?&title=Ion%20traps%20in%20nuclear%20physics-recent%20results%20and%20achievements&journal=Prog.%20Part.%20Nucl.%20Phys.&doi=10.1016%2Fj.ppnp.2016.08.001&volume=91&pages=259-293&publication_year=2016&author=Eronen%2CT&author=Kankainen%2CA&author=Aysto%2CJ
55, M. Brodeur et al., Penning-trap mass measurements in atomic and nuclear physics, Ann Rev Nucl Part Sci,2018,https://doi.org/10.1146%2Fannurev-nucl-102711-094939,http://scholar.google.com/scholar_lookup?&title=Penning-trap%20mass%20measurements%20in%20atomic%20and%20nuclear%20physics&journal=Ann.%20Rev.%20Nucl.%20Part.%20Sci.&doi=10.1146%2Fannurev-nucl-102711-094939&volume=68&pages=45-74&publication_year=2018&author=Dilling%2CJ&author=Blaum%2CK&author=Brodeur%2CM
56, The AME 2020 atomic mass evaluation (I). Evaluation of input data, and adjustment procedures, Chin Phys,2021,https://doi.org/10.1088%2F1674-1137%2Fabddb0,http://scholar.google.com/scholar_lookup?&title=The%20AME%202020%20atomic%20mass%20evaluation%20%28I%29.%20Evaluation%20of%20input%20data%2C%20and%20adjustment%20procedures&journal=Chin.%20Phys.%20C&doi=10.1088%2F1674-1137%2Fabddb0&volume=45&publication_year=2021&author=Huang%2CW&author=Wang%2CM&author=Kondev%2CF
57, M. Kortelainen et al., The limits of the nuclear landscape,,2012,https://doi.org/10.1038%2Fnature11188,http://scholar.google.com/scholar_lookup?&title=The%20limits%20of%20the%20nuclear%20landscape&journal=Nature&doi=10.1038%2Fnature11188&volume=486&pages=509-512&publication_year=2012&author=Erler%2CJ&author=Birge%2CN&author=Kortelainen%2CM
58, Y. Litvinov et al., Masses of exotic nuclei, Prog Part Nucl Phys,2021,https://doi.org/10.1016%2Fj.ppnp.2021.103882,http://scholar.google.com/scholar_lookup?&title=Masses%20of%20exotic%20nuclei&journal=Prog.%20Part.%20Nucl.%20Phys.&doi=10.1016%2Fj.ppnp.2021.103882&volume=120&publication_year=2021&author=Yamaguchi%2CT&author=Koura%2CH&author=Litvinov%2CY
59, J.E. Lawler et al., Origin of the heaviest elements: the rapid neutron-capture process, Rev Mod Phys,2021,https://doi.org/10.1103%2FRevModPhys.93.015002,http://scholar.google.com/scholar_lookup?&title=Origin%20of%20the%20heaviest%20elements%3A%20the%20rapid%20neutron-capture%20process&journal=Rev.%20Mod.%20Phys.&doi=10.1103%2FRevModPhys.93.015002&volume=93&publication_year=2021&author=Cowan%2CJJ&author=Sneden%2CC&author=Lawler%2CJE
60, K. Beckert et al., First isochronous mass spectrometry at the experimental storage ring ESR, Nucl Instrum Meth A,2000,https://doi.org/10.1016%2FS0168-9002%2899%2901192-4,http://scholar.google.com/scholar_lookup?&title=First%20isochronous%20mass%20spectrometry%20at%20the%20experimental%20storage%20ring%20ESR&journal=Nucl.%20Instrum.%20Meth.%20A.&doi=10.1016%2FS0168-9002%2899%2901192-4&volume=446&pages=569-580&publication_year=2000&author=Hausmann%2CM&author=Attallah%2CF&author=Beckert%2CK
61, 48Mn, 41Ti and 45Cr ions with isochronous mass spectrometry, Phys Lett,2004,https://doi.org/10.1016%2Fj.physletb.2004.02.014,http://scholar.google.com/scholar_lookup?&title=Direct%20mass%20measurement%20of%20bare%20short-lived%2044V%2C%2048Mn%2C%2041Ti%20and%2045Cr%20ions%20with%20isochronous%20mass%20spectrometry&journal=Phys.%20Lett.%20B&doi=10.1016%2Fj.physletb.2004.02.014&volume=586&pages=27-32&publication_year=2004&author=Stadlmann%2CJ&author=Hausmann%2CM&author=Attallah%2CF
